
Bus 002 Device 005: ID 046d:c214 Logitech, Inc. ATK3 (Attack III Joystick)
Device Descriptor:
  bLength                18
  bDescriptorType         1
  bcdUSB               1.10
  bDeviceClass            0
  bDeviceSubClass         0
  bDeviceProtocol         0
  bMaxPacketSize0         8
  idVendor           0x046d Logitech, Inc.
  idProduct          0xc214 ATK3 (Attack III Joystick)
  bcdDevice            2.05
  iManufacturer           1 Logitech
  iProduct                2 Logitech Attack 3
  iSerial                 0
  bNumConfigurations      1
  Configuration Descriptor:
    bLength                 9
    bDescriptorType         2
    wTotalLength       0x0022
    bNumInterfaces          1
    bConfigurationValue     1
    iConfiguration          0
    bmAttributes         0x80
      (Bus Powered)
    MaxPower               30mA
    Interface Descriptor:
      bLength                 9
      bDescriptorType         4
      bInterfaceNumber        0
      bAlternateSetting       0
      bNumEndpoints           1
      bInterfaceClass         3 Human Interface Device
      bInterfaceSubClass      0
      bInterfaceProtocol      0
      iInterface              0
        HID Device Descriptor:
          bLength                 9
          bDescriptorType        33
          bcdHID               1.10
          bCountryCode            0 Not supported
          bNumDescriptors         1
          bDescriptorType        34 Report
          wDescriptorLength      74
          Report Descriptor: (length is 74)
            Item(Global): Usage Page, data= [ 0x01 ] 1
                            Generic Desktop Controls
            Item(Local ): Usage, data= [ 0x04 ] 4
                            Joystick
            Item(Main  ): Collection, data= [ 0x01 ] 1
                            Application
            Item(Main  ): Collection, data= [ 0x02 ] 2
                            Logical
            Item(Global): Logical Minimum, data= [ 0x00 ] 0
            Item(Global): Logical Maximum, data= [ 0xff 0x00 ] 255
            Item(Global): Physical Minimum, data= [ 0x00 ] 0
            Item(Global): Physical Maximum, data= [ 0xff 0x00 ] 255
            Item(Global): Report Size, data= [ 0x08 ] 8
            Item(Global): Report Count, data= [ 0x03 ] 3
            Item(Local ): Usage, data= [ 0x30 ] 48
                            Direction-X
            Item(Local ): Usage, data= [ 0x31 ] 49
                            Direction-Y
            Item(Local ): Usage, data= [ 0x32 ] 50
                            Direction-Z
            Item(Main  ): Input, data= [ 0x02 ] 2
                            Data Variable Absolute No_Wrap Linear
                            Preferred_State No_Null_Position Non_Volatile Bitfield
            Item(Global): Logical Maximum, data= [ 0x01 ] 1
            Item(Global): Physical Maximum, data= [ 0x01 ] 1
            Item(Global): Report Size, data= [ 0x01 ] 1
            Item(Global): Report Count, data= [ 0x0b ] 11
            Item(Global): Usage Page, data= [ 0x09 ] 9
                            Buttons
            Item(Local ): Usage Minimum, data= [ 0x01 ] 1
                            Button 1 (Primary)
            Item(Local ): Usage Maximum, data= [ 0x0b ] 11
                            (null)
            Item(Main  ): Input, data= [ 0x02 ] 2
                            Data Variable Absolute No_Wrap Linear
                            Preferred_State No_Null_Position Non_Volatile Bitfield
            Item(Global): Report Size, data= [ 0x01 ] 1
            Item(Global): Report Count, data= [ 0x05 ] 5
            Item(Main  ): Input, data= [ 0x01 ] 1
                            Constant Array Absolute No_Wrap Linear
                            Preferred_State No_Null_Position Non_Volatile Bitfield
            Item(Main  ): End Collection, data=none
            Item(Main  ): Collection, data= [ 0x02 ] 2
                            Logical
            Item(Global): Logical Maximum, data= [ 0xff 0x00 ] 255
            Item(Global): Physical Maximum, data= [ 0xff 0x00 ] 255
            Item(Global): Report Size, data= [ 0x08 ] 8
            Item(Global): Report Count, data= [ 0x04 ] 4
            Item(Global): Usage Page, data= [ 0x00 0xff ] 65280
                            (null)
            Item(Local ): Usage, data= [ 0x01 ] 1
                            (null)
            Item(Main  ): Feature, data= [ 0x02 ] 2
                            Data Variable Absolute No_Wrap Linear
                            Preferred_State No_Null_Position Non_Volatile Bitfield
            Item(Main  ): End Collection, data=none
            Item(Main  ): End Collection, data=none
      Endpoint Descriptor:
        bLength                 7
        bDescriptorType         5
        bEndpointAddress     0x81  EP 1 IN
        bmAttributes            3
          Transfer Type            Interrupt
          Synch Type               None
          Usage Type               Data
        wMaxPacketSize     0x0005  1x 5 bytes
        bInterval              10
Device Status:     0x0000
  (Bus Powered)
